<xsd:schema xmlns:xsd="http://www.w3.org/2001/XMLSchema">
  <xsd:element name="NationalParks">
    <xsd:complexType>
      <xsd:sequence>
        <xsd:element name="NationalPark" maxOccurs="unbounded">
          <xsd:complexType>
            <xsd:sequence>
              <xsd:element name="Name" type="xsd:string"/>
              <xsd:element name="Phone" type="xsd:string" maxOccurs="unbounded"/>
              <xsd:element name="Address">
                <xsd:complexType>
                  <xsd:sequence>
                    <xsd:element name="Number" type="xsd:string"/>
                    <xsd:element name="Street" type="xsd:string"/>
                    <xsd:element name="City" type="xsd:string"/>
                    <xsd:element name="State" type="xsd:string"/>
                    <xsd:element name="Zip" type="xsd:string"/>
                  </xsd:sequence>
                  <xsd:attribute name="NearstAirport" type="xsd:string" use="required"/>
                </xsd:complexType>
              </xsd:element>
            </xsd:sequence>
            <xsd:attribute name="Rating" type="xsd:decimal" use="optional"/>
          </xsd:complexType>
        </xsd:element>
      </xsd:sequence>
    </xsd:complexType>
  </xsd:element>

</xsd:schema>
